Title,Link,Views,Likes,Comments,Channel Title,Description,Tags,Published
"Ex-Spec Ops Reacts To Call Of Duty Game","https://youtube.com/shorts/SlFafRdiyok",41159536,2158727,4743,"Tactical Beef","","",2025-03-13 06:30
"WHEN YOU PULL OFF THE SELF REVIVE - CALL OF DUTY WARZONE REBIRTH ISLAND","https://youtube.com/shorts/6aosSNGw3qg",29518049,381733,2017,"Goal Post68","#callofduty #cod #gaming #gamer #warzone #modernwarfare #blackops #callofdutymodernwarfare #callofdutymobile #videogames #youtube #memes #callofdutyblackops #codmw #battleroyale #streamer #codclips #callofdutywarzone #codwarzone #warzoneclips #callofdutymemes #callofdutyclips #codmemes #funny #gameplay #Warzone #CallOfDutyRanked #Streamers #FriendsGaming #GamingCommunity #PCgamging #OnlineGaming #youtube #youtubestream #youtubestreamer #resurgenceclips #VideoGameHumor #FunnyGameplay #GamingLaughs","",2024-07-29 01:55
"*NEW* Gun Noises for SMG's in Call of Duty?😂","https://youtube.com/shorts/kxwgUt0--vo",28277672,685496,12662,"JoshBarracks","*NEW* Gun Noises for SMG's in Call of Duty?😂 #MW3 #callofduty #JoshBarracks #shorts  I Turned Warzone Players into Pokemon  #Warzone #callofduty #JoshBarracks #shorts  Socials: Twitter: https://twitter.com/JoshBarracks Discord: https://discord.gg/FhBHmFJPfb TikTok: https://vm.tiktok.com/ZMdaDL2bQ/ Twitch: https://www.twitch.tv/JoshBarracks Merch: https://my-store-11579955.creator-spring.com/ Business Inquiries: JoshBaracksOfficial@Gmail.com  -------------------- Description Tags: mw3,mw3 gameplay,modern warfare 3,mw3 multiplayer gameplay,call of duty,mw3 multiplayer,mw3 trailer,mw3 2023,mw3 multiplayer beta,mw3 impressions,modern warfare iii,cod modern warfare 3,mw3 zombies,mwiii,joshbarracks,mw3zombies,modern warfare 3 zombies,call of duty zombies,codzombies,Warzone funny,Cod funny,call of duty funny,gaming,Gaming funny,warzone memes,gaming memes,memes,funny memes,Gun Noises,Warzone,Bo6","mw3, mw3 gameplay, modern warfare 3, mw3 multiplayer gameplay, call of duty, mw3 multiplayer, mw3 trailer, mw3 2023, mw3 multiplayer beta, mw3 impressions, modern warfare iii, cod modern warfare 3, mw3 zombies, mwiii, joshbarracks, mw3zombies, modern warfare 3 zombies, call of duty zombies, codzombies, Warzone funny, Cod funny, call of duty funny, gaming, Gaming funny, warzone memes, gaming memes, memes, funny memes, Gun Noises, Warzone, Bo6, gaming funny",2024-10-24 05:52
"Phân cảnh đau lòng trong Call Of Duty Black Ops Cold War","https://youtube.com/shorts/KLFn5cXIEac",10626601,427084,4905,"ThangGm","","",2024-07-17 21:51
"Squalz Vs Toxic Egirl..☕💀 #shorts #cod #warzone #movement #squidgame #sniper #egirl #squalz #viral","https://youtube.com/shorts/bW674pLrqZI",10220211,317710,1363,"Squalz","","",2025-01-19 14:50
"NEW HALLOWEEN LEAKED OPERATORS 🔥 #mw3 #cod #rebirthisland #warzone #movement #callofduty #blackops6","https://youtube.com/shorts/aIxKNklYivA",8215949,0,1751,"spahz","#cod #callofduty #warzone   Like, comment and subscribe :)  Socials Twitter: https://twitter.com/spahzed TikTok: https://www.tiktok.com/@ytspahz Instagram: https://www.instagram.com/spahz_                                                  Twitch: https://www.twitch.tv/convinced Kick: https://kick.com/spahz                                                                              Call of Duty: Warzone 2.0 is a free-to-play battle royale video game developed by Infinity Ward and Raven Software for PlayStation 4, Play Station 5, Windows, Xbox One, and Xbox Series X/S. It is a sequel to 2020's Call of Duty: Warzone. The game is a part of 2022's Call of Duty: Modern Warfare Il and 2023's Call of Duty: Modern Warfare III, but does not require purchase of any of the parent titles. It was introduced during Season 1 of Modern Warfare Il content. The game features cross-platform play and a new extraction mode titled DMZ  #warzone #callofduty #rebirthisland #movement #warzonegameplay #cod #modernwarfare #settings #warzonesettings #mw3 #classsetup #mwiii #modernwarfare3 #warzoneclasssetup #vondel #warzone3 #rebirth #faze #fazeclan #fazekicked #warzone #callofduty #cod #ps #modernwarfare #gaming #gamer #twitch #xbox #warzoneclips #blackops #callofdutymodernwarfare #playstation #fortnite #codwarzone #battleroyale #codmw #streamer #callofdutywarzone #codclips #twitchstreamer #youtube #memes #xboxone #pc #bo #videogames #mw #games #game #warzonememes #apexlegends #coldwar #codmobile #pcgaming #battlefield #callofdutymobile #sniper #gta #follow #gamers #twitchaffiliate #gamingcommunity #callofdutyclips #gamergirl #pubg #codtopplays #tiktok #modernwarfareclips #codmemes #twitchtv #faze #clips #meme #gulag #war #funny #streaming #esports #callofdutyblackops   Tags: Warzone, Warzone 2, Warzone 3, Modern Warfare, Modern Warfare II, Modern Warfare III, MW, MW2 MW3, Call of Duty, Rebirth Island, Rebirth Resurgence, Rebirth, Resurgence, Fortunes Keep, Urzikstan, Vondel, Ashika Island, Warzone Ranked, Ranked Play, Search and Destroy, SND, CDL, Best Warzone Controller Settings, Best Warzone Graphic Settings, Best Warzone Audio Settings, Best Warzone Settings, Best Warzone Movement Settings, Best Warzone Controller Settings for Movement & Aim, Claw Movement, Controller Movement, YY, Lionxo  Movement, YY, Movement, Warzone Movement, MW3 Movement, Slide Cancel, B-hop, Warzone Movement Guide, Warzone Gameplay, Warzone Settings, High Sensitivity, Low Sensitivity, Best Nvidia Filters, Movement King, The Real Movement King, Lion Warzone, Lion Movement, Lion, Warzone Loadout, Best Warzone Loadout, Best Warzone Class Setup, Best MW3 Class Setups, Best Warzone Class Setups For Movement & Aim, Best Warzone Movement Class Setups, Cheat, Hack, Aimbot, Wall hacks, Warzone Movement, Smooth Warzone Movement, Modern Warfare SND, Resurgence, Movement SMG, Ranked Warzone, Max Sensitivity Movement, Max Sensitivity Controller Settings, Low Sensitivity Movement, Lion, Smooth Movement, Low Sensitivity Controller Settings, Smooth Movement Controller Settings, Dynamic Aim Curve, Cheating, DS4 Windows, Controller Aim, Aim Assist, Scale Aim Assist With FOV, 240 hz, 120 FOV, Youtuber, Rebirth Settings, COD, Best Warzone Filters, DS4 Settings, Killing Twitch Streamers With Movement on Warzone","mw2, cod, modernwarfare, saxzu, zurly, movement, warzone, loadout, meta, chqser, mw3, cod mw3, #cod, #warzone, #classes, #yy, jvert, marnz, movement demon yy, mcrd, #esports, Lionxo, bo6, Console, Ps5, Twitch, Streamers, Smooth, Warzone gameplay, Movement guide, Call of duty, Class setups, Best class, Yy movement king, Ds4 settings, Black ops 6, Black ops 6 beta, Omni movement, Modern warfare 3, Movement settings, Movement king, Chqser settings, Sazkor, Nahv settings, Spahz, Rebirth, gta, gta6, Season6",2024-09-19 05:19
"Attempting a PERFECT Lego Call of Duty Ghost and Soap #lego #callofduty #cod","https://youtube.com/shorts/CwphlAa9P6Q",7040952,326628,1663,"FinCantBuild","","",2024-09-30 00:27
"This Uncle Streamer thought he could kill me..😭 #cod #warzone #movement #squidgame #squalz #viral","https://youtube.com/shorts/v1GO1_Cxe5Q",7344949,138683,378,"Squalz","","",2025-01-22 08:21
"Remember these Jumps in Call of Duty? #nostalgia","https://youtube.com/shorts/SMivuj7IPYY",6054576,181926,2915,"Zelta","#MW3 #warzone #callofduty  WATCH ME LIVE! https://www.twitch.tv/zelta Twitter : https://twitter.com/SoaRZelta Discord :  https://discord.gg/QMvjaMbdYg            Ignore  Warzone, Warzone2, Gaming, Call of Duty, Cod, Nostalgia, Cod Nostalgia, Cod4, WaW, World at War, Call of Duty 4, MW2, Modern Warfare 2, COD MW2, Black Ops, Black Ops 1, Call of Duty Black Ops, Black Ops 2, call of duty black ops 2, bo2, black ops 3, call of duty black ops 3, bo3, cod ghosts, black ops cold war, black ops 6, cod black ops 6, MW3, modern warfare 3, cod mw3, call of duty modern warfare 3, call of duty modern warfare iii, modern warfare 3 gameplay, mw3, mwiii, cod mwiii, gamer, sniper, sniping #MW3 #warzone #callofduty","call of duty, cod, mw3, modern warfare 3, mwiii, modern warfare iii, mw3 camo, mw3 sniping, sniping, cod mw3, cod mwiii, call of duty mw3, call of duty mwiii, bo2, black ops 2, warzone, call of duty warzone, cod4, mw2, modern warfare 2, world at war, nostalgia, shorts, black ops, black ops 1, bo1, call of duty black ops 2, rebirth island, best settings, cod nostalgia, call of duty nostalgia, wake up bro its 2009, wake up bro its 2010, wake up bro its 2011, wake up bro its 2012",2024-07-02 04:25
"NickEh30 makes Call of Duty family friendly","https://youtube.com/shorts/TfIwAkNQKTk",6026884,191536,892,"Nick Eh 30 Shorts","Can we keep it family friendly and no swearing in Call of Duty Black Ops 6?  ━━━━━━━━━━━━━  My Official Fortnite Maps (https://www.fortnite.com/@nickeh30)  🎢 Fortnite Funland 2 ➔ 2057-3742-0636 🔴 Red vs Blue Minigames ➔ 9333-1477-2716 ⚔️ Streamer Zone Wars ➔ 4716-2337-7573 ⚔️ Klombo Wars (Zero Build) ➔ 5087-4245-0507 🏁 King's Road ➔ 9310-8243-9088 🎇 OnlyUp Live Events ➔ 1350-8290-6429  ━━━━━━━━━━━━━  🎮 YOUTUBE (MAIN) ➔ @NickEh30  🎮 TWITCH ➔ https://www.Twitch.tv/NickEh30  📷 INSTAGRAM ➔ https://Instagram.com/NickEh30  🐦 TWITTER ➔ https://Twitter.com/NickEh30  🎭 FACEBOOK ➔ https://Facebook.com/NickEh30  📽️ TIKTOK ➔ https://www.tiktok.com/@nickeh30  📱 DISCORD ➔ https://www.Discord.gg/NickEh30  🖼️ SNAPCHAT ➔ https://www.Snapchat.com/add/NickEh30  ━━━━━━━━━━━━━  ⌨️ My official NickEh30 keyboard, mouse, and deskpad ➔ https://ghostkeyboards.com/NickEh30   👕 My Official Nick Eh 30 Merch ➔ https://NickEh30.Shop  ━━━━━━━━━━━━━  📮 Send Nick Eh 30 mail:  Nick Eh 30 PO Box 31047 Gladstone Halifax, Nova Scotia B3K 5T9  • All mail/packages should be sent using Canada Post (not UPS, FedEx, etc.), please and thank you. 🙂  ━━━━━━━━━━━━━  #COD #BlackOps6 #Shorts","NickEh30, Nick Eh 30, shorts",2024-09-04 07:09
"When You Play Prop Hunt in Call of Duty","https://youtube.com/shorts/9MS4Det-2Bc",5282542,243438,390,"ReidBoehm","","",2024-12-14 09:34
"Call of Duty: Black Ops 6 - The Replacer is ""Canelo’s Trainer""","https://youtube.com/shorts/7P3zbSWy6tg",5207138,6386,243,"Call of Duty","The Replacer is ready to take on any challenge 🥊 but we hear he fights dirty.  Follow #CallofDuty for the latest intel: • X / (Formerly Twitter): http://twitter.com/CallofDuty • Instagram: http://instagram.com/callofduty • Facebook: http://facebook.com/CallofDuty • TikTok: http://www.tiktok.com/@callofduty • Threads: https://www.threads.net/@callofduty","call of duty, cod, activision",2024-10-06 04:59
"Terrifier x Cod😈 / all skins & finishers in bio  #warzone # #callofduty #mw3","https://youtube.com/shorts/jy3YzYOmyXw",5180222,145026,828,"Wu77a","ALL CAMOS, OPERATORS & FINISHERS⭐ : https://discord.gg/mFXUn3Br (if this link don't work check link in bio) Socials: MY DISCORD : https://discord.gg/x4BzZsXUtv TWITCH : https://www.twitch.tv/wu77a TWITTER : https://x.com/WU77A TIKTOK : https://www.tiktok.com/@wu77a?is_from_webapp=1&sender_device=pc INSTAGRAM : https://www.instagram.com/wu77a/   #cod #warzone #rebirth #movement #settings #warzonesettings #twitch #streamers #classsetups #mw3 #modernwarfare #warzonemovement #warzone3  #mwiii #warzonegameplay #smooth #movementguide #rebirthisland #season3   Tags: WarZone 3, Rebirth Island, Killing Twitch Streamers in Mw3, Killing Twitch Streamers, wu77a Vs Twitch Streamer, Movement, controller, controller sensitivity, wu77a warzone, controller movement, warzone settings, best mw3 settings, best controller settings, best controller settings, best control settings, guide, Hacking, Aimbot, Warzone, Rebirth, Resurgence Rebirth,  Resurgence, Walls, Hacks, Cheating, modern warfare hackers, modern warfare cheaters, Controller aim, aim assist, aim curve, dynamic aim curve, scale aim assist with FOV, scale aim assist with FOV disabled, do not use scale aim assist with FOV enabled, low sensitivity, ice skating movement, movement for SnD, 240 hz, 120 FOV, Call of Duty Modern Warfare, Controller, Youtuber, best controller settings, controller settings, rebirth settings, warzone settings, best warzone settings, best movement settings, settings for warzone, max sensitivity controller settings,  movement, wu77a settings, the real movement king Youtuber, wu77a filters, best nvidia filter settings, nvidia filters, warzone nvidia filters, nvidia filters for warzone, best warzone filters, best mw3 settings, best mw3 beta, mw3 movement, mw3 beta movement, mw3 beta, ram-9 class, bp50 class, max mobility, max mobility class setup, solo squads,Movement, controller, controller sensitivity, wu77a warzone, controller movement, warzone settings, best warzone settings, best controller settings, best controller settings, best control settings, guide, Hacking, Aimbot, Warzone, Rebirth, Resurgence Rebirth,  Resurgence, Walls, Hacks, Cheating, modern warfare hackers, modern warfare cheaters, Controller aim, aim assist, aim curve, dynamic aim curve, scale aim assist with FOV, scale aim assist with FOV disabled, do not use scale aim assist with FOV enabled, low sensitivity, ice skating movement, movement for SnD, 240 hz, 120 FOV, Call of Duty Modern Warfare, Controller, Youtuber, best controller settings, controller settings, rebirth settings, warzone settings, best warzone settings, best movement settings, settings for warzone, max sensitivity controller settings, show settings, wu77a movement, wu77a settings, wu77a, the real movement king Youtuber, wu77a filters, best nvidia filter settings, nvidia filters, warzone nvidia filters, nvidia filters for warzone, best warzone filters   #callofduty  #tiktok #mw3 #rebirthisland #viral #fyp #cod #fortnite  modern warfare 3 warzone gameplay, modern warfare 3 warzone update, modern warfare 3, warzone slide cancel, mw3 warzone 3 slide cancel, mw3 warzone 3 movement, mw3 warzone 3 twitch streamers, rebirth island warzone, warzone rebirth island, vondel warzone, warzone vondel, warzone 3 gameplay, best loadout warzone 3, warzone 3 best loadout, warzone 3 loadout, vondel warzone 3, warzone 3 vondel, best loadout warzone, warzone best loadout, warzone","callofduty, warzone, rebirthisland, classsetup, warzonemeta",2024-10-12 04:02
"New Squid Game Operators & Skins | CALL OF DUTY BLACK OPS 6","https://youtube.com/shorts/7gF9qiUajLk",4936720,113043,342,"Game Movie ","Get ready for an epic crossover as Squid Game takes over Call of Duty: Black Ops 6 and Warzone! This special event marks the release of Squid Game Season 2, delivering heart-pounding action and suspense straight from the Netflix series into your favorite first-person shooter. Whether you're a fan of Squid Game, Call of Duty, or both, this collaboration is packed with exclusive content and rewards you don’t want to miss.  🎮 Explore Squid Game Operators Play as iconic characters like the Pink Guards, Masked VIPs, and the eerie yet unforgettable Young-Hee doll. From their detailed skins to unique animations and voice lines, these Operators bring Squid Game’s tense atmosphere to every match.  💥 Event Pass Rewards for Every Player Take part in the Squid Game 2 Event Pass to unlock amazing rewards, including:  Free Rewards: Instantly claim the Player 006 Operator Skin for Niran when you access the Event Pass. Earned Rewards: Grind through the Free Track to unlock the Player 115 Operator Skin by earning 76,000 XP. Premium Rewards: Upgrade to the Premium Pass for 1,100 Call of Duty Points and work your way to the ultimate prize—the Front Man Operator Skin, earned with 356,000 XP. 🛒 Themed Bundles in the Store Squid Game-themed bundles offer even more customization options to enhance your experience:  Pink Guards Tracer Pack: Features the Masked Worker, Soldier, and Manager skins, along with weapon blueprints, calling cards, reticles, and more. The VIPs Tracer Pack: Luxurious gold-themed Panther and Lion Masked VIP skins, exclusive weapon blueprints, and elegant cosmetics. Young-Hee Tracer Pack: The animatronic doll comes to life with toy-themed blueprints, sprays, decals, and other chilling cosmetics. 🔥 Custom Skins, Weapons, and More Equip unique blueprints like the Rule Master Assault Rifle, Satin Slayer SMG, or the Death Plated Frag Skin, and make your loadout stand out in every game. Bring the high-stakes tension of Squid Game to your battles with dramatic finishing moves like Winner and Pinky Up.  🌟 Why You Can’t Miss This Event This is more than just a collaboration—it's a celebration of two iconic franchises combining their strengths. Whether you're competing in Warzone or dominating multiplayer in Black Ops 6, the Squid Game event adds a thrilling new layer to the gameplay. Plus, the nostalgic nods to the show make it a treat for fans!  🕹️ It’s Your Turn to Survive the Games So, what are you waiting for? Jump into the action, complete challenges, unlock exclusive rewards, and experience the thrill of Squid Game in the world of Call of Duty. Play, survive, and become the ultimate winner!  #SquidGame #SquidGameSeason2 #CallOfDuty #BlackOps6 #Warzone #SquidGameCrossover #NetflixGaming #CODWarzone #FPSGaming #BattleRoyale #PinkGuards #MaskedVIPs #YoungHee #FrontMan #SquidGameOperators #CODEvents #WarzoneSeason #GamingCommunity #GameCollaboration #PlayToWin #CODFans #NetflixSeries #SquidGameEvent #SurvivalGames","call of duty black ops 6 gamepaly, ending, final boss, multiplayer full match, Black ops 6 campaign, black ops 6 zombies ending, bo6 zombies cutscenes, bo6 zombies full game movie, cod black ops 6 terminus ending, fall of liberty ending, black ops 6 squid game, black ops 6 squid game full match, black ops 6 squid game bundle, black ops 6 squid game skins, black ops 6 squid game event, black ops 6 multiplayer gameplay, black ops 6 squid games, black ops 6 squid game event pass",2025-01-05 20:00
"UPGRADING The PERFECT Lego Call Of Duty Ghost #lego #cod #callofduty","https://youtube.com/shorts/Akd5i2PFkWA",5206224,239861,945,"FinCantBuild","","",2025-01-10 00:53
"I 1v5'd for $1,000! Do u think you can beat me? #codm #shorts","https://youtube.com/shorts/1fUV0TQVoJk",5193970,263411,5161,"Ganyth","Become a member: https://www.youtube.com/channel/UCATf0yguIqqCD-FSkG-sd1w/join  Infinite Esports Discord: https://discord.gg/infinitena - - - - - - - - - - - - - - - - - - - - - - - - - - - - - - - - - - - - -  Socials: Instagram: https://www.instagram.com/gxnyth/ Youtube: https://www.youtube.com/c/GanythCODM TikTok: https://www.tiktok.com/@ganyth? Discord: https://discord.gg/GcDZ9xH5uu Twitter: https://twitter.com/ganyth Gmail: ganythcontact@gmail.com - - - - - - - - - - - - - - - - - - - - - - - - - - - - - - - - - - - - -  Device: iPad Pro 4th 2022 Editing: LumaFusion Tundra Gunsmith: https://youtu.be/m1fVIIGO9nQ?si=fbgj-oHI1dXOrUKa Sniper Gunsmith: https://youtu.be/IflJFRiPNX8?si=3w0g53L4BsYZrRze Settings & Sensitivity: https://youtu.be/MV5xH-PywVs?si=tqKD5RyAvhAAFhkK Handcam: https://youtu.be/1ZAZykMKL_8?si=GIlvWnScohoFHke1 - - - - - - - - - - - - - - - - - - - - - - - - - - - - - - - - - - - - -  Call of Duty: Mobile is a free-to-play shooter video game developed by TiMi Studios and published by Activision and Garena for Android and iOS. It was released on October 1, 2019. The game saw one of the largest mobile game launches in history, generating over US$327 million with 250 million downloads by June 2020.  #CallOfDuty #CallOfDutyMobile #CoDm #CoDMobile #Highlights #Sniper #CodMobile_Partner #8OnTop","Ganyth, Call of Duty Mobile, Call of Duty, CoD, CoDM, Call of Duty: Mobile, Sniper, Best Sniper, Highlight, Montage",2024-09-11 10:34
"💀EL JUGADOR MÁS VIEJO DE CALL OF DUTY","https://youtube.com/shorts/Cd3ez5LEXRM",4464522,569218,1424,"JWulen","","",2024-08-31 04:52
"Ransom 😈| Warzone Trickshot #shorts","https://youtube.com/shorts/V2PIC-0WqFo",5683841,236557,2087,"𝐋𝐞𝐯𝐢 Warzone","#callofduty #cod  #warzone  #rebirth  #movement #rebirthisland     Call of Duty: Warzone 2.0[b] is a free-to-play battle royale video game developed by Infinity Ward and Raven Software for PlayStation 4, PlayStation 5, Windows, Xbox One, and Xbox Series X/S.[2] It is a sequel to 2020's Call of Duty: Warzone. The game is a part of 2022's Call of Duty: Modern Warfare II but does not require purchase of the parent title. It was introduced during Season 1 of Modern Warfare II content. The game features cross-platform play and a new extraction mode titled DMZ.[3]    bo6, blackops 6, black ops, mw2019, #Warzone #CallofDuty #CoDWarzone","warzone, movement, rebirth island, rebirth movement, movement demon, warzone 2 movement, slide canceling, mw2 demon, mw2 movement, smooth movement, black ops 6 movement, warzone 4, black ops 6 warzone, bo6 warzone, rebirth, wz sniping, sniping, trickshot, warzone trickshot, levi call of duty, levi warzone, levi sniping, levi settings, levi wz",2025-03-17 11:29
"Kratos’ Voice Actor Destroys Call of Duty at The Game Awards","https://youtube.com/shorts/M_KnxTFu45g",4293472,155624,1040,"MARION ","","",2024-11-25 16:50
"OG Rebirth Island is Beautiful 🤩 #callofduty #warzone #cod #modernwarfare #blackops6 #rebirthisland","https://youtube.com/shorts/5RRa1wjOP9M",4562625,193826,2173,"AverageAnas","#cod #warzone #rebirth #movement #settings #warzonesettings #twitch #streamers #classsetups #mw3 #modernwarfare #warzonemovement #warzone3  #mwiii #warzonegameplay #smooth #movementguide #rebirthisland #season3   Tags: WarZone 3, Rebirth Island, Killing Twitch Streamers in Mw3, Killing Twitch Streamers, Vs Twitch Streamer, Movement, controller, controller sensitivity, average anas warzone, controller movement, warzone settings, best mw3 settings, best controller settings, best controller settings, best control settings, guide, Hacking, Aimbot, Warzone, Rebirth, Resurgence Rebirth,  Resurgence, Walls, Hacks, Cheating, modern warfare hackers, modern warfare cheaters, Controller aim, aim assist, aim curve, dynamic aim curve, scale aim assist with FOV, scale aim assist with FOV disabled, do not use scale aim assist with FOV enabled, low sensitivity, ice skating movement, movement for SnD, 240 hz, 120 FOV, Call of Duty Modern Warfare, Controller, Youtuber, best controller settings, controller settings, rebirth settings, warzone settings, best warzone settings, best movement settings, settings for warzone, max sensitivity controller settings,  movement, average anas settings, the real movement king Youtuber, wu77a filters, best nvidia filter settings, nvidia filters, warzone nvidia filters, nvidia filters for warzone, best warzone filters, best mw3 settings, best mw3 beta, mw3 movement, mw3 beta movement, mw3 beta, ram-9 class, bp50 class, max mobility, max mobility class setup, solo squads,Movement, controller, controller sensitivity, average anas warzone, controller movement, warzone settings, best warzone settings, best controller settings, best controller settings, best control settings, guide, Hacking, Aimbot, Warzone, Rebirth, Resurgence Rebirth,  Resurgence, Walls, Hacks, Cheating, modern warfare hackers, modern warfare cheaters, Controller aim, aim assist, aim curve, dynamic aim curve, scale aim assist with FOV, scale aim assist with FOV disabled, do not use scale aim assist with FOV enabled, low sensitivity, ice skating movement, movement for SnD, 240 hz, 120 FOV, Call of Duty Modern Warfare, Controller, Youtuber, best controller settings, controller settings, rebirth settings, warzone settings, best warzone settings, best movement settings, settings for warzone, max sensitivity controller settings, show settings, average anas movement, average anas settings, average anas, the real movement king Youtuber, average anas filters, best nvidia filter settings, nvidia filters, average anas nvidia filters, nvidia filters for warzone, best warzone filters    #callofduty  #tiktok #mw3 #rebirthisland #viral #fyp #cod #fortnite  modern warfare 3 warzone gameplay, modern warfare 3 warzone update, modern warfare 3, warzone slide cancel, mw3 warzone 3 slide cancel, mw3 warzone 3 movement, mw3 warzone 3 twitch streamers, rebirth island warzone, warzone rebirth island, vondel warzone, warzone vondel, warzone 3 gameplay, best loadout warzone 3, warzone 3 best loadout, warzone 3 loadout, vondel warzone 3, warzone 3 vondel, best loadout warzone, warzone best loadout, warzone","",2025-01-18 01:34
"¿Sabías ESTO de Call of Duty: BLACK OPS 6? 🛥️ #callofdutyblackops6 #callofduty #easteregg #gaming","https://youtube.com/shorts/Vjq7fx4zPkE",4059865,256028,547,"Vandal","","",2024-11-02 01:58
"Не понял что убил друга - Call of Duty  Black Ops II EDIT | Santigold - L.E.S. artistes","https://youtube.com/shorts/H_LcuTuOa8I",3621066,139013,1360,"HOUSE SHELBY | RESERVE","Не понял что убил друга - Call of Duty  Black Ops II EDIT | Santigold - L.E.S. artistes #shorts #callofduty #callofdutyblackops #reels #edit #blackops","",2024-07-05 03:00
